<databaseChangeLog
        xmlns="http://www.liquibase.org/xml/ns/dbchangelog/1.0"
        xmlns:xsi="http://www.w3.org/2001/XMLSchema-instance"
        xsi:schemaLocation="http://www.liquibase.org/xml/ns/dbchangelog/1.0 http://www.liquibase.org/xml/ns/dbchangelog/dbchangelog-1.0.xsd">

    <changeSet id="1" author="Alice">
        <createTable tableName="NewsItems">
            <column name="id" type="int">
                <constraints primaryKey="true" nullable="false"/>
            </column>
            <column name="title" type="varchar(255)">
                <constraints nullable="false"/>
            </column>
            <column name="newsDate" type="TIMESTAMP">
                <constraints nullable="false"/>
            </column>
            <column name="author" type="int">
                <constraints nullable="false" foreignKeyName="fk_newsitem_person" references="People(id)"/>
            </column>
            <column name="content" type="CLOB">
                <constraints nullable="false"/>
            </column>
        </createTable>
    </changeSet>

    <!--changeSet id="2" author="Bob">
        <insert tableName="NewsItems">
            <column name="id" value="1"/>
            <column name="title" value="First Post!"/>
            <column name="newsDate" value="15-SEP-2006 12:15:08"/>
            <column name="author" value="2"/>
            <column name="content" value="Welcome to the news area"/>
        </insert>
        <insert tableName="NewsItems">
            <column name="id" value="2"/>
            <column name="title" value="Second Post!"/>
            <column name="newsDate" value="17-SEP-2006 11:15:08"/>
            <column name="author" value="3"/>
            <column name="content" value="I can welcome you too"/>
        </insert>
    </changeSet-->
    <!--changeSet id="3" author="Bob" runAlways="true">
        <sql>update NewsItems set content=to_char(sysdate) where id=2</sql>
    </changeSet-->
    <!--changeSet id="4" author="Bob" runOnChange="true">
        <sql>update NewsItems set title='Second Post 4', content=to_char(sysdate) where id=1</sql>
    </changeSet-->

</databaseChangeLog>