<?xml version="1.0" encoding="UTF-8"?>

<databaseChangeLog
        xmlns="http://www.liquibase.org/xml/ns/dbchangelog/1.0"
        xmlns:xsi="http://www.w3.org/2001/XMLSchema-instance"
        xsi:schemaLocation="http://www.liquibase.org/xml/ns/dbchangelog/1.0 http://www.liquibase.org/xml/ns/dbchangelog/dbchangelog-1.0.xsd">
    <preConditions>
            <dbms type="oracle"/>
    </preConditions>

    <changeSet id="1" author="nvoxland">
        <createTable tableName="magazine">
            <column name="id" type="int">
                <constraints primaryKey="true" nullable="false"/>
            </column>
            <column name="title" type="varchar(50)">
                <constraints nullable="false"/>
            </column>

        </createTable>
    </changeSet>
    <changeSet id="2" author="nvoxland">
        <addColumn tableName="magazine">
            <column name="sku" type="varchar(50)">
                <constraints nullable="false"/>
            </column>
        </addColumn>
        <createIndex indexName="idx_magazine_sku" tableName="magazine">
            <column name="sku"/>
        </createIndex>
    </changeSet>
    <changeSet id="3" author="nvoxland">
        <dropNotNullConstraint tableName="magazine" columnName="title" columnDataType="varchar(50)"/>
    </changeSet>
    <changeSet id="4" author="nvoxland">
        <renameColumn tableName="magazine" oldColumnName="sku" newColumnName="isbn"/>
    </changeSet>
    <changeSet id="5" author="nvoxland">
        <renameTable oldTableName="magazine" newTableName="publication"/>
    </changeSet>

    <changeSet id="6" author="nvoxland">
        <comment>
            Refactorings that can't be automatically rolled back can be custom rolled back with a "rollback" tag.
        </comment>
        <insert tableName="publication">
            <column name="id" value="1"/>
            <column name="title" value="Refactoring Times"/>
            <column name="isbn" value="12981-512712-512"/>
        </insert>
        <insert tableName="publication">
            <column name="id" value="2"/>
            <column name="title" value="Databases Today"/>
            <column name="isbn" value="51235-632-6232623"/>
        </insert>
        <insert tableName="publication">
            <column name="id" value="3"/>
            <column name="title" value="Newsweek"/>
            <column name="isbn" value="623-6623-332262"/>
        </insert>
        <rollback>
            delete from publication;
        </rollback>
    </changeSet>

    <changeSet id="7" author="nvoxland">
        <addColumn tableName="publication">
            <column name="pages" type="int"/>
        </addColumn>
    </changeSet>
    <changeSet id="8" author="nvoxland">
        <addNotNullConstraint tableName="publication" columnName="title" columnDataType="varchar(50)" defaultNullValue="-1"/>
    </changeSet>

    <changeSet id="9" author="nvoxland">
        <createSequence sequenceName="seq_publication_id"/>
    </changeSet>
</databaseChangeLog>